{
  "version": 3,
  "source": ["tokens/*.json"],
  "output": "./expected",
  "themeAliases": {
    "fontFamily": "font/family",
    "fontWeight": "font/weight",
    "lineHeight": "font/leading",
    "fontSize": "font/size",
    "screens": "screen",
    "spacing": "size",
    "borderRadius": "rounded",
    "extend": {
      "animation": "animation",
      "keyframes": "keyframes"
    }
  }
}
